{
  "question": "What is the concept of peptide conformational stability in formulation?",
  "options": [
    "Sequence stability only",
    "The thermodynamic and kinetic stability of the peptide's 3D structure in the formulation environment",
    "Only shelf life",
    "Only manufacturing stability"
  ],
  "correctIndex": 1,
  "explanation": "Conformational stability determines whether the peptide maintains its active conformation throughout storage, affected by pH, excipients, and temperature.",
  "difficulty": "advanced",
  "tags": [
    "formulation",
    "delivery"
  ]
}